runner_name,selection_id,market_id,market_name,venue,start_time_dublin,p_win,p_place,bet_type,ew_places,ew_fraction,tags,why_now
Relevant Range,44215151,1.252492088,1m Class Stks,Newcastle,2026-01-10T16:20:00.000Z,0.32,0.68,Win,3,0.2,"enhanced_analysis,Clear favorite with shortest odds, suggesting strong recent form and class advantage","Despite not being in the initial selections, Relevant Range's odds suggest it's the class of the field and shouldn't be overlooked"
Yorkstone,49317685,1.252492088,1m Class Stks,Newcastle,2026-01-10T16:20:00.000Z,0.23,0.55,EW,3,0.2,"enhanced_analysis,Consistent form, good course record, underestimated by the market","Solid value play given the course form and market underestimation, but caution advised"
Eagles Whistle,75227910,1.252492088,1m Class Stks,Newcastle,2026-01-10T16:20:00.000Z,0.2,0.5,EW,3,0.2,"enhanced_analysis,Joint second favorite, suggesting strong recent performances","Market confidence warrants inclusion, but approach with caution due to initial omission"
Crownthorpe,12844803,1.252492088,1m Class Stks,Newcastle,2026-01-10T16:20:00.000Z,0.12,0.35,EW,3,0.2,"enhanced_analysis,Potential class advantage, improving form, overlooked in competitive field",Offers value but at higher risk; include as a speculative each-way option
One More Bottle,2744317,1.252492088,1m Class Stks,Newcastle,2026-01-10T16:20:00.000Z,0.08,0.25,EW,3,0.2,"enhanced_analysis,Potential improver at longer odds, could surprise","Included to round out selections, but approach with extreme caution"
