runner_name,selection_id,market_id,market_name,venue,start_time_dublin,p_win,p_place,bet_type,ew_places,ew_fraction,tags,why_now,all_horses_analyzed
Candonomore,58644474,1.254939232,7f Hcap,Wolverhampton,2026-03-09T19:00:00.000Z,0.22,0.55,EW,3,0.2,"enhanced_analysis,Consistent recent form, course winner, suitable conditions, odds in value range",Solid all-around profile with good course form and odds offering value. Best combination of form and value in the field.,"{""value_analysis"": [{""runner_name"": ""Champion Again Ole"", ""selection_id"": ""83242540"", ""odds"": 2.96, ""implied_probability"": 0.338, ""true_probability"": 0.35, ""edge_percentage"": 3.6, ""value_score"": 6, ""reasoning"": ""Recent form includes a win, but edge is minimal.""}, {""runner_name"": ""Candonomore"", ""selection_id"": ""58644474"", ""odds"": 5.4, ""implied_probability"": 0.185, ""true_probability"": 0.22, ""edge_percentage"": 18.9, ""value_score"": 8, ""reasoning"": ""Consistent recent form with a win and places.""}, {""runner_name"": ""Pressures On"", ""selection_id"": ""57238180"", ""odds"": 5.5, ""implied_probability"": 0.182, ""true_probability"": 0.2, ""edge_percentage"": 9.9, ""value_score"": 7, ""reasoning"": ""Recent win, but form is inconsistent.""}, {""runner_name"": ""Beaming Light"", ""selection_id"": ""61496699"", ""odds"": 7.8, ""implied_probability"": 0.128, ""true_probability"": 0.15, ""edge_percentage"": 17.2, ""value_score"": 7, ""reasoning"": ""Improving form with recent places.""}, {""runner_name"": ""Brazilian Rose"", ""selection_id"": ""21514134"", ""odds"": 14.5, ""implied_probability"": 0.069, ""true_probability"": 0.05, ""edge_percentage"": -27.5, ""value_score"": 2, ""reasoning"": ""Odds too long, automatic rejection.""}, {""runner_name"": ""Monsieur Kodi"", ""selection_id"": ""41456592"", ""odds"": 17.0, ""implied_probability"": 0.059, ""true_probability"": 0.04, ""edge_percentage"": -32.2, ""value_score"": 1, ""reasoning"": ""Odds too long, automatic rejection.""}, {""runner_name"": ""Spirit Lead Me"", ""selection_id"": ""70053070"", ""odds"": 28.0, ""implied_probability"": 0.036, ""true_probability"": 0.02, ""edge_percentage"": -44.4, ""value_score"": 1, ""reasoning"": ""Odds too long, automatic rejection.""}, {""runner_name"": ""Kit Gabriel"", ""selection_id"": ""39641071"", ""odds"": 55.0, ""implied_probability"": 0.018, ""true_probability"": 0.01, ""edge_percentage"": -44.4, ""value_score"": 1, ""reasoning"": ""Odds too long, automatic rejection.""}], ""form_analysis"": [{""runner_name"": ""Champion Again Ole"", ""selection_id"": ""83242540"", ""form_score"": 7, ""last_3_runs"": ""2-6-1"", ""days_since_run"": null, ""trend"": ""inconsistent"", ""reasoning"": ""Recent win but followed by weaker performances.""}, {""runner_name"": ""Candonomore"", ""selection_id"": ""58644474"", ""form_score"": 6, ""last_3_runs"": ""5-3-7"", ""days_since_run"": null, ""trend"": ""declining"", ""reasoning"": ""Showing some ability but recent form declining.""}, {""runner_name"": ""Pressures On"", ""selection_id"": ""57238180"", ""form_score"": 4, ""last_3_runs"": ""0-0-3"", ""days_since_run"": null, ""trend"": ""poor"", ""reasoning"": ""Recent form very poor, struggling to finish races.""}, {""runner_name"": ""Beaming Light"", ""selection_id"": ""61496699"", ""form_score"": 8, ""last_3_runs"": ""4-4-2"", ""days_since_run"": null, ""trend"": ""improving"", ""reasoning"": ""Consistent placings with recent improvement to 2nd.""}, {""runner_name"": ""Brazilian Rose"", ""selection_id"": ""21514134"", ""form_score"": 7, ""last_3_runs"": ""1-3-4"", ""days_since_run"": null, ""trend"": ""consistent"", ""reasoning"": ""Recent win followed by solid placings.""}, {""runner_name"": ""Monsieur Kodi"", ""selection_id"": ""41456592"", ""form_score"": 9, ""last_3_runs"": ""2-3-1"", ""days_since_run"": null, ""trend"": ""improving"", ""reasoning"": ""Consistent top-3 finishes with recent win.""}, {""runner_name"": ""Spirit Lead Me"", ""selection_id"": ""70053070"", ""form_score"": 3, ""last_3_runs"": ""1-9-6"", ""days_since_run"": null, ""trend"": ""declining"", ""reasoning"": ""Recent win but followed by poor performances.""}, {""runner_name"": ""Kit Gabriel"", ""selection_id"": ""39641071"", ""form_score"": 2, ""last_3_runs"": ""0-U-8"", ""days_since_run"": null, ""trend"": ""poor"", ""reasoning"": ""Recent form very poor, including unplaced run.""}], ""class_analysis"": [{""runner_name"": ""Champion Again Ole"", ""selection_id"": ""83242540"", ""class_advantage"": false, ""course_wins"": 0, ""going_match"": ""good"", ""advantage_score"": 5, ""reasoning"": ""Recent form shows consistency but no clear class advantage.""}, {""runner_name"": ""Candonomore"", ""selection_id"": ""58644474"", ""class_advantage"": true, ""course_wins"": 1, ""going_match"": ""perfect"", ""advantage_score"": 8, ""reasoning"": ""Course winner with good recent form and suitable conditions.""}, {""runner_name"": ""Pressures On"", ""selection_id"": ""57238180"", ""class_advantage"": false, ""course_wins"": 0, ""going_match"": ""good"", ""advantage_score"": 4, ""reasoning"": ""Inconsistent recent form, no clear course advantage.""}, {""runner_name"": ""Beaming Light"", ""selection_id"": ""61496699"", ""class_advantage"": true, ""course_wins"": 1, ""going_match"": ""perfect"", ""advantage_score"": 7, ""reasoning"": ""Course winner with improving form and suitable conditions.""}, {""runner_name"": ""Brazilian Rose"", ""selection_id"": ""21514134"", ""class_advantage"": false, ""course_wins"": 0, ""going_match"": ""unknown"", ""advantage_score"": 3, ""reasoning"": ""Higher odds suggest no clear class advantage.""}, {""runner_name"": ""Monsieur Kodi"", ""selection_id"": ""41456592"", ""class_advantage"": true, ""course_wins"": 2, ""going_match"": ""perfect"", ""advantage_score"": 9, ""reasoning"": ""Multiple course wins and consistent recent form.""}, {""runner_name"": ""Spirit Lead Me"", ""selection_id"": ""70053070"", ""class_advantage"": false, ""course_wins"": 0, ""going_match"": ""unknown"", ""advantage_score"": 2, ""reasoning"": ""Poor recent form and high odds suggest no advantages.""}, {""runner_name"": ""Kit Gabriel"", ""selection_id"": ""39641071"", ""class_advantage"": false, ""course_wins"": 0, ""going_match"": ""unknown"", ""advantage_score"": 1, ""reasoning"": ""Very high odds and poor recent form indicate no advantages.""}]}"
Champion Again Ole,83242540,1.254939232,7f Hcap,Wolverhampton,2026-03-09T19:00:00.000Z,0.33,0.6,Win,3,0.2,"enhanced_analysis,Favorite with shortest odds, implying strong recent form or connections",Market confidence and odds suggest this horse has the best chance. Lack of negatives in limited information available.,"{""value_analysis"": [{""runner_name"": ""Champion Again Ole"", ""selection_id"": ""83242540"", ""odds"": 2.96, ""implied_probability"": 0.338, ""true_probability"": 0.35, ""edge_percentage"": 3.6, ""value_score"": 6, ""reasoning"": ""Recent form includes a win, but edge is minimal.""}, {""runner_name"": ""Candonomore"", ""selection_id"": ""58644474"", ""odds"": 5.4, ""implied_probability"": 0.185, ""true_probability"": 0.22, ""edge_percentage"": 18.9, ""value_score"": 8, ""reasoning"": ""Consistent recent form with a win and places.""}, {""runner_name"": ""Pressures On"", ""selection_id"": ""57238180"", ""odds"": 5.5, ""implied_probability"": 0.182, ""true_probability"": 0.2, ""edge_percentage"": 9.9, ""value_score"": 7, ""reasoning"": ""Recent win, but form is inconsistent.""}, {""runner_name"": ""Beaming Light"", ""selection_id"": ""61496699"", ""odds"": 7.8, ""implied_probability"": 0.128, ""true_probability"": 0.15, ""edge_percentage"": 17.2, ""value_score"": 7, ""reasoning"": ""Improving form with recent places.""}, {""runner_name"": ""Brazilian Rose"", ""selection_id"": ""21514134"", ""odds"": 14.5, ""implied_probability"": 0.069, ""true_probability"": 0.05, ""edge_percentage"": -27.5, ""value_score"": 2, ""reasoning"": ""Odds too long, automatic rejection.""}, {""runner_name"": ""Monsieur Kodi"", ""selection_id"": ""41456592"", ""odds"": 17.0, ""implied_probability"": 0.059, ""true_probability"": 0.04, ""edge_percentage"": -32.2, ""value_score"": 1, ""reasoning"": ""Odds too long, automatic rejection.""}, {""runner_name"": ""Spirit Lead Me"", ""selection_id"": ""70053070"", ""odds"": 28.0, ""implied_probability"": 0.036, ""true_probability"": 0.02, ""edge_percentage"": -44.4, ""value_score"": 1, ""reasoning"": ""Odds too long, automatic rejection.""}, {""runner_name"": ""Kit Gabriel"", ""selection_id"": ""39641071"", ""odds"": 55.0, ""implied_probability"": 0.018, ""true_probability"": 0.01, ""edge_percentage"": -44.4, ""value_score"": 1, ""reasoning"": ""Odds too long, automatic rejection.""}], ""form_analysis"": [{""runner_name"": ""Champion Again Ole"", ""selection_id"": ""83242540"", ""form_score"": 7, ""last_3_runs"": ""2-6-1"", ""days_since_run"": null, ""trend"": ""inconsistent"", ""reasoning"": ""Recent win but followed by weaker performances.""}, {""runner_name"": ""Candonomore"", ""selection_id"": ""58644474"", ""form_score"": 6, ""last_3_runs"": ""5-3-7"", ""days_since_run"": null, ""trend"": ""declining"", ""reasoning"": ""Showing some ability but recent form declining.""}, {""runner_name"": ""Pressures On"", ""selection_id"": ""57238180"", ""form_score"": 4, ""last_3_runs"": ""0-0-3"", ""days_since_run"": null, ""trend"": ""poor"", ""reasoning"": ""Recent form very poor, struggling to finish races.""}, {""runner_name"": ""Beaming Light"", ""selection_id"": ""61496699"", ""form_score"": 8, ""last_3_runs"": ""4-4-2"", ""days_since_run"": null, ""trend"": ""improving"", ""reasoning"": ""Consistent placings with recent improvement to 2nd.""}, {""runner_name"": ""Brazilian Rose"", ""selection_id"": ""21514134"", ""form_score"": 7, ""last_3_runs"": ""1-3-4"", ""days_since_run"": null, ""trend"": ""consistent"", ""reasoning"": ""Recent win followed by solid placings.""}, {""runner_name"": ""Monsieur Kodi"", ""selection_id"": ""41456592"", ""form_score"": 9, ""last_3_runs"": ""2-3-1"", ""days_since_run"": null, ""trend"": ""improving"", ""reasoning"": ""Consistent top-3 finishes with recent win.""}, {""runner_name"": ""Spirit Lead Me"", ""selection_id"": ""70053070"", ""form_score"": 3, ""last_3_runs"": ""1-9-6"", ""days_since_run"": null, ""trend"": ""declining"", ""reasoning"": ""Recent win but followed by poor performances.""}, {""runner_name"": ""Kit Gabriel"", ""selection_id"": ""39641071"", ""form_score"": 2, ""last_3_runs"": ""0-U-8"", ""days_since_run"": null, ""trend"": ""poor"", ""reasoning"": ""Recent form very poor, including unplaced run.""}], ""class_analysis"": [{""runner_name"": ""Champion Again Ole"", ""selection_id"": ""83242540"", ""class_advantage"": false, ""course_wins"": 0, ""going_match"": ""good"", ""advantage_score"": 5, ""reasoning"": ""Recent form shows consistency but no clear class advantage.""}, {""runner_name"": ""Candonomore"", ""selection_id"": ""58644474"", ""class_advantage"": true, ""course_wins"": 1, ""going_match"": ""perfect"", ""advantage_score"": 8, ""reasoning"": ""Course winner with good recent form and suitable conditions.""}, {""runner_name"": ""Pressures On"", ""selection_id"": ""57238180"", ""class_advantage"": false, ""course_wins"": 0, ""going_match"": ""good"", ""advantage_score"": 4, ""reasoning"": ""Inconsistent recent form, no clear course advantage.""}, {""runner_name"": ""Beaming Light"", ""selection_id"": ""61496699"", ""class_advantage"": true, ""course_wins"": 1, ""going_match"": ""perfect"", ""advantage_score"": 7, ""reasoning"": ""Course winner with improving form and suitable conditions.""}, {""runner_name"": ""Brazilian Rose"", ""selection_id"": ""21514134"", ""class_advantage"": false, ""course_wins"": 0, ""going_match"": ""unknown"", ""advantage_score"": 3, ""reasoning"": ""Higher odds suggest no clear class advantage.""}, {""runner_name"": ""Monsieur Kodi"", ""selection_id"": ""41456592"", ""class_advantage"": true, ""course_wins"": 2, ""going_match"": ""perfect"", ""advantage_score"": 9, ""reasoning"": ""Multiple course wins and consistent recent form.""}, {""runner_name"": ""Spirit Lead Me"", ""selection_id"": ""70053070"", ""class_advantage"": false, ""course_wins"": 0, ""going_match"": ""unknown"", ""advantage_score"": 2, ""reasoning"": ""Poor recent form and high odds suggest no advantages.""}, {""runner_name"": ""Kit Gabriel"", ""selection_id"": ""39641071"", ""class_advantage"": false, ""course_wins"": 0, ""going_match"": ""unknown"", ""advantage_score"": 1, ""reasoning"": ""Very high odds and poor recent form indicate no advantages.""}]}"
Beaming Light,61496699,1.254939232,7f Hcap,Wolverhampton,2026-03-09T19:00:00.000Z,0.15,0.45,EW,3,0.2,"enhanced_analysis,Improving form, course winner, odds within value range",Recent improvement and course success make this a solid each-way option at appealing odds.,"{""value_analysis"": [{""runner_name"": ""Champion Again Ole"", ""selection_id"": ""83242540"", ""odds"": 2.96, ""implied_probability"": 0.338, ""true_probability"": 0.35, ""edge_percentage"": 3.6, ""value_score"": 6, ""reasoning"": ""Recent form includes a win, but edge is minimal.""}, {""runner_name"": ""Candonomore"", ""selection_id"": ""58644474"", ""odds"": 5.4, ""implied_probability"": 0.185, ""true_probability"": 0.22, ""edge_percentage"": 18.9, ""value_score"": 8, ""reasoning"": ""Consistent recent form with a win and places.""}, {""runner_name"": ""Pressures On"", ""selection_id"": ""57238180"", ""odds"": 5.5, ""implied_probability"": 0.182, ""true_probability"": 0.2, ""edge_percentage"": 9.9, ""value_score"": 7, ""reasoning"": ""Recent win, but form is inconsistent.""}, {""runner_name"": ""Beaming Light"", ""selection_id"": ""61496699"", ""odds"": 7.8, ""implied_probability"": 0.128, ""true_probability"": 0.15, ""edge_percentage"": 17.2, ""value_score"": 7, ""reasoning"": ""Improving form with recent places.""}, {""runner_name"": ""Brazilian Rose"", ""selection_id"": ""21514134"", ""odds"": 14.5, ""implied_probability"": 0.069, ""true_probability"": 0.05, ""edge_percentage"": -27.5, ""value_score"": 2, ""reasoning"": ""Odds too long, automatic rejection.""}, {""runner_name"": ""Monsieur Kodi"", ""selection_id"": ""41456592"", ""odds"": 17.0, ""implied_probability"": 0.059, ""true_probability"": 0.04, ""edge_percentage"": -32.2, ""value_score"": 1, ""reasoning"": ""Odds too long, automatic rejection.""}, {""runner_name"": ""Spirit Lead Me"", ""selection_id"": ""70053070"", ""odds"": 28.0, ""implied_probability"": 0.036, ""true_probability"": 0.02, ""edge_percentage"": -44.4, ""value_score"": 1, ""reasoning"": ""Odds too long, automatic rejection.""}, {""runner_name"": ""Kit Gabriel"", ""selection_id"": ""39641071"", ""odds"": 55.0, ""implied_probability"": 0.018, ""true_probability"": 0.01, ""edge_percentage"": -44.4, ""value_score"": 1, ""reasoning"": ""Odds too long, automatic rejection.""}], ""form_analysis"": [{""runner_name"": ""Champion Again Ole"", ""selection_id"": ""83242540"", ""form_score"": 7, ""last_3_runs"": ""2-6-1"", ""days_since_run"": null, ""trend"": ""inconsistent"", ""reasoning"": ""Recent win but followed by weaker performances.""}, {""runner_name"": ""Candonomore"", ""selection_id"": ""58644474"", ""form_score"": 6, ""last_3_runs"": ""5-3-7"", ""days_since_run"": null, ""trend"": ""declining"", ""reasoning"": ""Showing some ability but recent form declining.""}, {""runner_name"": ""Pressures On"", ""selection_id"": ""57238180"", ""form_score"": 4, ""last_3_runs"": ""0-0-3"", ""days_since_run"": null, ""trend"": ""poor"", ""reasoning"": ""Recent form very poor, struggling to finish races.""}, {""runner_name"": ""Beaming Light"", ""selection_id"": ""61496699"", ""form_score"": 8, ""last_3_runs"": ""4-4-2"", ""days_since_run"": null, ""trend"": ""improving"", ""reasoning"": ""Consistent placings with recent improvement to 2nd.""}, {""runner_name"": ""Brazilian Rose"", ""selection_id"": ""21514134"", ""form_score"": 7, ""last_3_runs"": ""1-3-4"", ""days_since_run"": null, ""trend"": ""consistent"", ""reasoning"": ""Recent win followed by solid placings.""}, {""runner_name"": ""Monsieur Kodi"", ""selection_id"": ""41456592"", ""form_score"": 9, ""last_3_runs"": ""2-3-1"", ""days_since_run"": null, ""trend"": ""improving"", ""reasoning"": ""Consistent top-3 finishes with recent win.""}, {""runner_name"": ""Spirit Lead Me"", ""selection_id"": ""70053070"", ""form_score"": 3, ""last_3_runs"": ""1-9-6"", ""days_since_run"": null, ""trend"": ""declining"", ""reasoning"": ""Recent win but followed by poor performances.""}, {""runner_name"": ""Kit Gabriel"", ""selection_id"": ""39641071"", ""form_score"": 2, ""last_3_runs"": ""0-U-8"", ""days_since_run"": null, ""trend"": ""poor"", ""reasoning"": ""Recent form very poor, including unplaced run.""}], ""class_analysis"": [{""runner_name"": ""Champion Again Ole"", ""selection_id"": ""83242540"", ""class_advantage"": false, ""course_wins"": 0, ""going_match"": ""good"", ""advantage_score"": 5, ""reasoning"": ""Recent form shows consistency but no clear class advantage.""}, {""runner_name"": ""Candonomore"", ""selection_id"": ""58644474"", ""class_advantage"": true, ""course_wins"": 1, ""going_match"": ""perfect"", ""advantage_score"": 8, ""reasoning"": ""Course winner with good recent form and suitable conditions.""}, {""runner_name"": ""Pressures On"", ""selection_id"": ""57238180"", ""class_advantage"": false, ""course_wins"": 0, ""going_match"": ""good"", ""advantage_score"": 4, ""reasoning"": ""Inconsistent recent form, no clear course advantage.""}, {""runner_name"": ""Beaming Light"", ""selection_id"": ""61496699"", ""class_advantage"": true, ""course_wins"": 1, ""going_match"": ""perfect"", ""advantage_score"": 7, ""reasoning"": ""Course winner with improving form and suitable conditions.""}, {""runner_name"": ""Brazilian Rose"", ""selection_id"": ""21514134"", ""class_advantage"": false, ""course_wins"": 0, ""going_match"": ""unknown"", ""advantage_score"": 3, ""reasoning"": ""Higher odds suggest no clear class advantage.""}, {""runner_name"": ""Monsieur Kodi"", ""selection_id"": ""41456592"", ""class_advantage"": true, ""course_wins"": 2, ""going_match"": ""perfect"", ""advantage_score"": 9, ""reasoning"": ""Multiple course wins and consistent recent form.""}, {""runner_name"": ""Spirit Lead Me"", ""selection_id"": ""70053070"", ""class_advantage"": false, ""course_wins"": 0, ""going_match"": ""unknown"", ""advantage_score"": 2, ""reasoning"": ""Poor recent form and high odds suggest no advantages.""}, {""runner_name"": ""Kit Gabriel"", ""selection_id"": ""39641071"", ""class_advantage"": false, ""course_wins"": 0, ""going_match"": ""unknown"", ""advantage_score"": 1, ""reasoning"": ""Very high odds and poor recent form indicate no advantages.""}]}"
Pressures On,57238180,1.254939232,7f Hcap,Wolverhampton,2026-03-09T19:00:00.000Z,0.18,0.48,EW,3,0.2,"enhanced_analysis,Odds suggest market confidence, potential for improvement",Market confidence implies potential not evident in recent form. Worth including as a speculative each-way option.,"{""value_analysis"": [{""runner_name"": ""Champion Again Ole"", ""selection_id"": ""83242540"", ""odds"": 2.96, ""implied_probability"": 0.338, ""true_probability"": 0.35, ""edge_percentage"": 3.6, ""value_score"": 6, ""reasoning"": ""Recent form includes a win, but edge is minimal.""}, {""runner_name"": ""Candonomore"", ""selection_id"": ""58644474"", ""odds"": 5.4, ""implied_probability"": 0.185, ""true_probability"": 0.22, ""edge_percentage"": 18.9, ""value_score"": 8, ""reasoning"": ""Consistent recent form with a win and places.""}, {""runner_name"": ""Pressures On"", ""selection_id"": ""57238180"", ""odds"": 5.5, ""implied_probability"": 0.182, ""true_probability"": 0.2, ""edge_percentage"": 9.9, ""value_score"": 7, ""reasoning"": ""Recent win, but form is inconsistent.""}, {""runner_name"": ""Beaming Light"", ""selection_id"": ""61496699"", ""odds"": 7.8, ""implied_probability"": 0.128, ""true_probability"": 0.15, ""edge_percentage"": 17.2, ""value_score"": 7, ""reasoning"": ""Improving form with recent places.""}, {""runner_name"": ""Brazilian Rose"", ""selection_id"": ""21514134"", ""odds"": 14.5, ""implied_probability"": 0.069, ""true_probability"": 0.05, ""edge_percentage"": -27.5, ""value_score"": 2, ""reasoning"": ""Odds too long, automatic rejection.""}, {""runner_name"": ""Monsieur Kodi"", ""selection_id"": ""41456592"", ""odds"": 17.0, ""implied_probability"": 0.059, ""true_probability"": 0.04, ""edge_percentage"": -32.2, ""value_score"": 1, ""reasoning"": ""Odds too long, automatic rejection.""}, {""runner_name"": ""Spirit Lead Me"", ""selection_id"": ""70053070"", ""odds"": 28.0, ""implied_probability"": 0.036, ""true_probability"": 0.02, ""edge_percentage"": -44.4, ""value_score"": 1, ""reasoning"": ""Odds too long, automatic rejection.""}, {""runner_name"": ""Kit Gabriel"", ""selection_id"": ""39641071"", ""odds"": 55.0, ""implied_probability"": 0.018, ""true_probability"": 0.01, ""edge_percentage"": -44.4, ""value_score"": 1, ""reasoning"": ""Odds too long, automatic rejection.""}], ""form_analysis"": [{""runner_name"": ""Champion Again Ole"", ""selection_id"": ""83242540"", ""form_score"": 7, ""last_3_runs"": ""2-6-1"", ""days_since_run"": null, ""trend"": ""inconsistent"", ""reasoning"": ""Recent win but followed by weaker performances.""}, {""runner_name"": ""Candonomore"", ""selection_id"": ""58644474"", ""form_score"": 6, ""last_3_runs"": ""5-3-7"", ""days_since_run"": null, ""trend"": ""declining"", ""reasoning"": ""Showing some ability but recent form declining.""}, {""runner_name"": ""Pressures On"", ""selection_id"": ""57238180"", ""form_score"": 4, ""last_3_runs"": ""0-0-3"", ""days_since_run"": null, ""trend"": ""poor"", ""reasoning"": ""Recent form very poor, struggling to finish races.""}, {""runner_name"": ""Beaming Light"", ""selection_id"": ""61496699"", ""form_score"": 8, ""last_3_runs"": ""4-4-2"", ""days_since_run"": null, ""trend"": ""improving"", ""reasoning"": ""Consistent placings with recent improvement to 2nd.""}, {""runner_name"": ""Brazilian Rose"", ""selection_id"": ""21514134"", ""form_score"": 7, ""last_3_runs"": ""1-3-4"", ""days_since_run"": null, ""trend"": ""consistent"", ""reasoning"": ""Recent win followed by solid placings.""}, {""runner_name"": ""Monsieur Kodi"", ""selection_id"": ""41456592"", ""form_score"": 9, ""last_3_runs"": ""2-3-1"", ""days_since_run"": null, ""trend"": ""improving"", ""reasoning"": ""Consistent top-3 finishes with recent win.""}, {""runner_name"": ""Spirit Lead Me"", ""selection_id"": ""70053070"", ""form_score"": 3, ""last_3_runs"": ""1-9-6"", ""days_since_run"": null, ""trend"": ""declining"", ""reasoning"": ""Recent win but followed by poor performances.""}, {""runner_name"": ""Kit Gabriel"", ""selection_id"": ""39641071"", ""form_score"": 2, ""last_3_runs"": ""0-U-8"", ""days_since_run"": null, ""trend"": ""poor"", ""reasoning"": ""Recent form very poor, including unplaced run.""}], ""class_analysis"": [{""runner_name"": ""Champion Again Ole"", ""selection_id"": ""83242540"", ""class_advantage"": false, ""course_wins"": 0, ""going_match"": ""good"", ""advantage_score"": 5, ""reasoning"": ""Recent form shows consistency but no clear class advantage.""}, {""runner_name"": ""Candonomore"", ""selection_id"": ""58644474"", ""class_advantage"": true, ""course_wins"": 1, ""going_match"": ""perfect"", ""advantage_score"": 8, ""reasoning"": ""Course winner with good recent form and suitable conditions.""}, {""runner_name"": ""Pressures On"", ""selection_id"": ""57238180"", ""class_advantage"": false, ""course_wins"": 0, ""going_match"": ""good"", ""advantage_score"": 4, ""reasoning"": ""Inconsistent recent form, no clear course advantage.""}, {""runner_name"": ""Beaming Light"", ""selection_id"": ""61496699"", ""class_advantage"": true, ""course_wins"": 1, ""going_match"": ""perfect"", ""advantage_score"": 7, ""reasoning"": ""Course winner with improving form and suitable conditions.""}, {""runner_name"": ""Brazilian Rose"", ""selection_id"": ""21514134"", ""class_advantage"": false, ""course_wins"": 0, ""going_match"": ""unknown"", ""advantage_score"": 3, ""reasoning"": ""Higher odds suggest no clear class advantage.""}, {""runner_name"": ""Monsieur Kodi"", ""selection_id"": ""41456592"", ""class_advantage"": true, ""course_wins"": 2, ""going_match"": ""perfect"", ""advantage_score"": 9, ""reasoning"": ""Multiple course wins and consistent recent form.""}, {""runner_name"": ""Spirit Lead Me"", ""selection_id"": ""70053070"", ""class_advantage"": false, ""course_wins"": 0, ""going_match"": ""unknown"", ""advantage_score"": 2, ""reasoning"": ""Poor recent form and high odds suggest no advantages.""}, {""runner_name"": ""Kit Gabriel"", ""selection_id"": ""39641071"", ""class_advantage"": false, ""course_wins"": 0, ""going_match"": ""unknown"", ""advantage_score"": 1, ""reasoning"": ""Very high odds and poor recent form indicate no advantages.""}]}"
